premium	name	response_letter_required	city	latitude	longtitude	raw	experience	schedule	employment	skills	has_test	employer	salary_from	salary_to	gross	currency
False	Системный администратор	False	Москва	55.723232	37.766262	Москва, Рязанский проспект, 16с4	От 1 года до 3 лет	Полный день	Полная занятость		False	Divit.pro	40000.0	45000.0	False	RUR
False	Токарь	False	Каменск-Уральский	56.426477	61.908485	Каменск-Уральский, Лермонтова, 40	От 1 года до 3 лет	Полный день	Полная занятость		False	Каменск-Уральский завод по обработке цветных металлов		59000.0	True	RUR
False	Сетевой инженер (Сахалин)	False	N/A	N/A	N/A	N/A	От 3 до 6 лет	Полный день	Полная занятость	Cisco_BGP_VLAN_D-Link_STP	False	Восточная горнорудная компания	100000.0	110000.0	False	RUR
False	Оператор-наладчик станков с ПУ 4-5 разряда	False	Санкт-Петербург	59.863165	30.475876	Санкт-Петербург, проспект Обуховской Обороны, 120	От 1 года до 3 лет	Полный день	Полная занятость	Станки ЧПУ_ЕСКД	False	Российский институт радионавигации и времени (РИРВ)	45000.0		True	RUR
False	Fullstack (PHP/JS) middle	False	N/A	N/A	N/A	N/A	От 1 года до 3 лет	Полный день	Полная занятость	PostgreSQL_MySQL_PHP_Vue.js	False	ПРОФИТКЛИКС	140000.0	170000.0	False	RUR
False	Механик по выпуску транспорта	False	N/A	N/A	N/A	N/A	От 3 до 6 лет	Полный день	Полная занятость	Знание устройства автомобиля_Пользователь ПК_Техническое обслуживание_Ремонт импортной техники	False	СтройБлокТехнология	50000.0		False	RUR
False	Ведущий программист (Senior) С / Linux	False	Москва	55.684031	37.342634	Москва, Западный административный округ, Можайский район, Инновационный центр Сколково, улица Нобеля, 7	От 3 до 6 лет	Полный день	Полная занятость	C_язык С_ARP_BFD_DHCP_DHCP Server/Relay_VRRP_OSPF_ISIS_BGP_Broadcom_Intel_Marvel	False	БУЛАТ	180000.0		False	RUR
False	Сервисный инженер	False	Москва	55.728991	37.632727	Москва, улица Зацепа, 21с3	От 3 до 6 лет	Полный день	Полная занятость	Проектирование и монтаж пожарной сигнализации_Умение работать в условиях многозадачности	False	СЕТЬ	85000.0	90000.0	False	RUR
False	Системный администратор 1-С	False	N/A	N/A	N/A	N/A	От 3 до 6 лет	Полный день	Полная занятость	Базы данных_SQL_1С: Предприятие 8_Тестирование_1С программирование	False	Федеральное государственное бюджетное учреждение культуры Государственный фонд кинофильмов Российской Федерации	80000.0		False	RUR
False	Специалист IT отдела (центр города)	False	Санкт-Петербург	59.906639	30.30552	Санкт-Петербург, набережная Обводного канала, 118Б	От 1 года до 3 лет	Полный день	Полная занятость	Настройка сетевых подключений_Настройка ПК_Настройка ПО_Сборка ПК_Ремонт ПК_Выездное обслуживание_Техническое обслуживание	False	МАГНИТ, Розничная сеть		66000.0	True	RUR
False	Инженер-программист (схемотехник разработчик ПЛИС)	False	Москва	55.85817	37.529394	Москва, 4й Лихачевский переулок, 15	От 3 до 6 лет	Полный день	Полная занятость	Verilog HDL_VHDL_C/C++_Математическое моделирование_Оперативный поиск информации в сети Интернет	False	ФГУП НИИ Квант	130000.0	140000.0	True	RUR
False	Инженер-программист 1С	False	Йошкар-Ола	56.611776	47.870197	Йошкар-Ола, улица Строителей, 98	От 1 года до 3 лет	Полный день	Полная занятость	1С программирование_SQL_1С: Предприятие 8_1С: Управление Производственным Предприятием_Тестирование	False	ТЕХНОТЕХ	60000.0		True	RUR
False	Ведущий специалист отдела регионального ИТ сервиса	False	N/A	N/A	N/A	N/A	От 1 года до 3 лет	Полный день	Полная занятость	Мобильность_Настройка сетевых подключений_Настройка ПО_Настройка ПК_Windows 7	False	Совкомбанк Технологии	40000.0	45000.0	False	RUR
False	Копирайтер	False	N/A	N/A	N/A	N/A	От 3 до 6 лет	Полный день	Полная занятость	Грамотность_Грамотная речь_Наполнение контентом_Работа в команде_Активные продажи	False	Академия Создания Капитала	40000.0		False	RUR
False	Менеджер по развитию агентской (партнерской) сети	False	Оренбург	51.80801	55.153208	Оренбург, проезд Автоматики, 10/3	От 1 года до 3 лет	Полный день	Полная занятость	Ведение переговоров_Поиск и привлечение клиентов_B2B Продажи_Мобильность_Активные продажи	False	Krovelson	40000.0	90000.0	False	RUR
False	Стажер-программист Java	False	N/A	N/A	N/A	N/A	От 1 года до 3 лет	Полный день	Полная занятость	SQL_Java_ООП_Oracle DB_Java Core_Паттерны проектирования	False	Квадриум	35000.0	100000.0	True	RUR
False	Golang Developer | Golang middle+/senior	False	N/A	N/A	N/A	N/A	От 3 до 6 лет	Полный день	Полная занятость	Git_PostgreSQL_Linux_Atlassian Jira_Go_Docker_Микросервисная архитектура_Golang	False	Сеть Партнерств	300000.0		False	RUR
False	Главный специалист по информационным технологиям	False	Москва	55.810071	37.509083	Москва, Ленинградский проспект, 80кб	Более 6 лет	Полный день	Полная занятость	Управление проектами_Информационные технологии_ITIL_Оптимизация бизнес-процессов	False	ИТКОЛ-сервеинг	130000.0		False	RUR
False	Программист микроконтроллеров	False	N/A	N/A	N/A	N/A	От 3 до 6 лет	Полный день	Полная занятость	C/C++_Qt_Linux_Git_C++_Программирование микроконтроллеров_Работа в условиях многозадачности_IoT_LoRaWAN_LPWAN_UART	False	Смартико	150000.0	200000.0	True	RUR
False	Сервисный инженер (Банкоматов)	False	Москва	55.750484	37.539527	Москва, 1-й Красногвардейский проезд, 15	От 1 года до 3 лет	Полный день	Полная занятость	Английский язык_MS PowerPoint_Windows Os_MS Dos_NDC_Wincor Nixdorf_сервисное обслуживание_Работа с терминалом_Банкоматы_Техническое обслуживание_эмбоссер	False	ФФИН Банк		100000.0	True	RUR
False	Системный администратор	False	N/A	N/A	N/A	N/A	От 3 до 6 лет	Полный день	Полная занятость	Active Directory_Администрирование серверов Windows_VMware_DHCP_Hyper-V	False	Инрусинвест	60000.0	60000.0	False	RUR
False	Электромеханик по лифтам и подъемно-транспортному оборудованию	False	Москва	55.708029	37.50098	Москва, Мосфильмовская улица, 80	Нет опыта	Полный день	Полная занятость		False	ФКУ Войсковая часть 52582	55000.0	65000.0	False	RUR
False	Начинающий тестировщик ПО / QA-engineer	False	Барнаул	53.370463	83.758378	Барнаул, улица Аносова, 3Б	Нет опыта	Полный день	Полная занятость	Тестирование_Тестирование пользовательского интерфейса_Ручное тестирование_Автоматическое тестирование_Функциональное тестирование_Регрессионное тестирование	False	Cyberia (Назмутдинов Рафаэль Талгатович)	30000.0	40000.0	False	RUR
False	Инженер-программист	False	N/A	N/A	N/A	N/A	Нет опыта	Полный день	Полная занятость	Linux_Документальное сопровождение_Windows 7_Разработка инструкций_MS Office	False	Одинцовский ОВО - филиал ФГКУ УВО ВНГ России по Московской области	20000.0	23000.0	False	RUR
False	Дизайнер	False	Калининград	54.715369	20.362634	Калининград, 1-я Алтайская улица, 29А	От 1 года до 3 лет	Полный день	Полная занятость	Adobe Illustrator_Adobe Photoshop_Графический дизайн_CorelDRAW_Разработка фирменного стиля_Креативность_Наружная реклама_Лендинг_Photoshop_Позитивное мышление_Смекалка_Коммуникабельность, ответственность_Хорошее знание ПК	False	Кормилов	40000.0		False	RUR
False	Программист 1С	False	Балашиха	55.729133	38.014969	Балашиха, микрорайон Железнодорожный, Автозаводская улица, 52к1	От 1 года до 3 лет	Полный день	Полная занятость	1С: Предприятие 8_1C: Бухгалтерия_1С программирование_1C: Предприятие_1С: Зарплата и управление персоналом_1С-ЭДО	False	Хеттих РУС		126000.0	True	RUR
False	Старший бизнес-аналитик (Руководитель группы)	False	Пермь	57.991755	56.206869	Пермь, шоссе Космонавтов, 111к10	От 3 до 6 лет	Полный день	Полная занятость	Аналитическое мышление_Разработка технических заданий_Деловая переписка_Redmine_Умение принимать решения_Системное мышление_Управление временем_Стрессоустойчивость_Пунктуальность_BPMN_UML_Бизнес-анализ_Постановка задач разработчикам_MS Visio_Аналитика_Деловое общение_Организаторские навыки_Работа с большим объемом информации	False	DIGITAL FUTURE SYSTEMS	80000.0		False	RUR
False	Системный администратор	False	Новомосковск	54.026789	38.272318	Новомосковск, улица Дружбы, 8Е	От 1 года до 3 лет	Полный день	Полная занятость	Настройка ПК_Windows 7_Настройка сетевых подключений_Настройка ПО_Администрирование сетевого оборудования	False	AlkiR	60000.0	60000.0	True	RUR
False	Программист микроконтроллеров/встраиваемых систем (Embedded Developer)	False	Санкт-Петербург	59.947	30.266892	Санкт-Петербург, 11-я линия Васильевского острова, 66	От 1 года до 3 лет	Полный день	Полная занятость	ARM_Qt_Linux_C/C++_TCP/IP_Микроконтроллеры_Программирование микроконтроллеров_Разработка технической документации_AVR	False	Группа промышленных компаний “Корпорация ТИРА”	70000.0	70000.0	True	RUR
False	Токарь-универсал	False	Люберцы	55.665675	37.899122	Люберцы, Котельнический проезд, 14А	От 3 до 6 лет	Полный день	Полная занятость		False	ПК РПЦ	85000.0		True	RUR
False	Механик по транспорту	True	N/A	N/A	N/A	N/A	От 3 до 6 лет	Полный день	Полная занятость	Знание устройства автомобиля_Ремонтные работы_Работа в команде_Организация технического обслуживания автомобилей_Умение работать в команде_Точность и внимательность к деталям	False	Компания СТС	80000.0		False	RUR
False	Дизайнер одежды	False	Екатеринбург	56.83878	60.591276	Екатеринбург, улица Антона Валека, 15	От 1 года до 3 лет	Полный день	Полная занятость	Adobe Illustrator_Adobe Photoshop_Дизайн_CorelDRAW_Деловая коммуникация_Творческое мышление_Многозадачность_Мониторинг рынка	False	СТРОЧКА	45000.0	65000.0	False	RUR
False	Комплектатор / Менеджер по комплектации дизайн-проектов	False	Тамбов	52.749715	41.457349	Тамбов, Моршанское шоссе, 24М	От 1 года до 3 лет	Полный день	Полная занятость	CRM_Клиентоориентированность_Организаторские навыки_Управление персоналом_Активные продажи	False	Studio7	30000.0		False	RUR
False	Администратор сервиса по ремонту и обслуживанию сельхозтехники	False	Уфа	54.660959	56.082623	Уфа, Нагаевское шоссе, 29	От 1 года до 3 лет	Полный день	Полная занятость	Администрирование_MS PowerPoint_Административная поддержка руководителя_Электронный документооборот_Английский язык_Работа с базами данных_Деловое общение_Деловая коммуникация_Подготовка отчетов_Документооборот_Умение работать с большим объемом информации	False	Zoomlion Heavy Industry Science&Technology Co., Ltd.	52000.0		True	RUR
False	Специалист технической поддержки	False	Санкт-Петербург	59.915048	30.315302	Санкт-Петербург, 2-я Красноармейская улица, 4	От 1 года до 3 лет	Полный день	Полная занятость	Коммуникабельность_Администрирование серверов Windows_Active Directory_Настройка ПК_Ремонт ПК_Настройка ПО_Администрирование клиентских операционных систем_Microsoft System Center_Установка ПО	False	ФГБОУ ВО Санкт-Петербургский государственный архитектурно-строительный университет	40000.0		True	RUR
False	Мастер / техник сервисного обслуживания	False	Санкт-Петербург	59.923405	30.363649	Санкт-Петербург, Лиговский проспект, 50к11	Нет опыта	Полный день	Полная занятость	Умение работать в команде	False	АГРАД	68000.0	68000.0	False	RUR
False	Техник по подключению новых абонентов	False	N/A	N/A	N/A	N/A	От 1 года до 3 лет	Полный день	Полная занятость	Мобильность	False	МЕТО технологии	60000.0		True	RUR
False	Заместитель руководителя проекта	False	Москва	55.77355	37.678963	Москва, Бакунинская улица, 1-3	От 3 до 6 лет	Полный день	Полная занятость		False	ВЕСТА		180000.0	True	RUR
False	Senior Business Development Manager for FinTech	False					От 3 до 6 лет	Полный день	Полная занятость	Английский язык_Sales Management_MS PowerPoint_Business English_Business Development	False	Мунэксперт	120000.0	240000.0	True	RUR
False	Системотехник	False	Красноярск	56.035537	92.930689	Красноярск, улица Партизана Железняка, 35А	От 1 года до 3 лет	Полный день	Полная занятость	Настройка ПК_Настройка ПО_Настройка сетевых подключений_Техническое обслуживание_Администрирование серверов Windows_Установка и настройка ПО_MS Windows_Техническая поддержка	False	МАГНИТ, Розничная сеть	53000.0	60000.0	True	RUR
False	Инженер-механик	False	N/A	N/A	N/A	N/A	Нет опыта	Полный день	Полная занятость		False	Мираторг, Агропромышленный холдинг	50000.0		False	RUR
False	Инженер КИП и А	False	станция Евсино	54.512382	83.348171	станция Евсино	От 3 до 6 лет	Полный день	Полная занятость	3 группа по электробезопасности_Автоматизация технологических процессов_Чтение электросхем_Компас-3D_Техническое обслуживание	False	Группа Сибантрацит		86000.0	True	RUR
False	Оператор телефонной поддержки Директа	False	N/A	N/A	N/A	N/A	Нет опыта	Полный день	Полная занятость		False	Яндекс		60000.0	True	RUR
False	Менеджер интернет-проектов	False	N/A	N/A	N/A	N/A	От 1 года до 3 лет	Полный день	Полная занятость	Git_Docker_SQL_Управление командой_Scrum_Управление интернет-проектами	False	Технология Карьеры	100000.0	140000.0	False	RUR
False	Frontend-разработчик	False	Казань	55.791663	49.13092	Казань, улица Щапова, 14/31	От 1 года до 3 лет	Полный день	Полная занятость	JavaScript_HTML_Кроссбраузерная верстка_Адаптивная верстка_Vuetify_SCSS_Vue.js_Frontend	False	АйТиБрик	80000.0	120000.0	True	RUR
False	Менеджер дизайн-проектов	False	Санкт-Петербург	59.902352	30.320836	Санкт-Петербург, Киевская улица, 3	От 1 года до 3 лет	Полный день	Полная занятость	Грамотная речь_Работа в команде_CRM_Активные продажи_Деловое общение_Ориентация на результат_Креативность	False	Реал-Проект	80000.0		True	RUR
False	Оператор-наладчик станков с ЧПУ	False	Санкт-Петербург	59.907988	30.391542	Санкт-Петербург, Фаянсовая улица, 22И	От 3 до 6 лет	Полный день	Полная занятость	Станки ЧПУ_CAD_ADEM_Гарантийное обслуживание_Машиностроение_Технический склад ума_Профессиональный пользователь ПК	False	НТЦ Редуктор	70000.0		False	RUR
False	Дизайнер	False	Набережные Челны	55.662253	52.273451	Набережные Челны, Магистральная улица, 53А	От 1 года до 3 лет	Полный день	Полная занятость	Adobe Photoshop_CorelDRAW_Креативность_Дизайн_Базис-мебельщик_Творческое мышление	False	Казанская Сантехническая Компания	25000.0	35000.0	True	RUR
False	Сервисный мастер	False	Вологда	59.20555	39.835755	Вологда, Ленинградская улица, 144	От 1 года до 3 лет	Полный день	Полная занятость	Работа с клиентами_Гарантийное обслуживание	False	Бигам, компания	35000.0		False	RUR
False	Инженер сервисной службы	False	Барнаул	53.333177	83.667343	Барнаул, улица Попова, 208А	От 1 года до 3 лет	Полный день	Полная занятость	Выездное обслуживание_Техническое обслуживание	False	Компрессор центр	40000.0		True	RUR
False	Оператор станка с ЧПУ (плазменная резка)	False	Ярославль	57.616736	39.966784	Ярославль, проспект Машиностроителей, 83	От 3 до 6 лет	Полный день	Полная занятость	Пользователь ПК_Способность обучать других_Работа в условиях многозадачности_Высокая трудоспособность_Работа в команде_Работа с компьютером_Коммуникабельность, ответственность	False	НПФ ЭКОСЕРВИС	60000.0		False	RUR
False	Сервисный инженер / Специалист технической поддержки магазинов / Инженер по ИТ оборудованию	False	N/A	N/A	N/A	N/A	От 1 года до 3 лет	Полный день	Полная занятость		False	ДИКСИ, группа компаний	58200.0		True	RUR
False	Инженер сопровождения сетевой инфраструктуры	False	N/A	N/A	N/A	N/A	От 1 года до 3 лет	Полный день	Полная занятость		False	СБЕР	52300.0		False	RUR
False	Токарь-универсал	False	N/A	N/A	N/A	N/A	От 1 года до 3 лет	Полный день	Полная занятость	Работа в команде_Точность и внимательность к деталям_токарная обработка деталей_Чтение чертежей	False	Машиностроительный завод ЗиО-Подольск	130000.0		True	RUR
False	Маркетолог-аналитик	False	Подольск	55.473878	37.573681	Подольск, Вишнёвая улица, 1А	От 1 года до 3 лет	Полный день	Полная занятость	Анализ рынка_Маркетинговые исследования_SWOT анализ_Подготовка презентаций_Adobe Photoshop	False	Премиум Стандарт	60000.0		False	RUR
False	PHP-разработчик (Laravel)	False	N/A	N/A	N/A	N/A	От 3 до 6 лет	Полный день	Полная занятость	Git_ООП_PostgreSQL_SQL_Linux_PHP_Laravel	False	Бэш-Тудэй	200000.0	230000.0	False	RUR
False	Frontend (React) разработчик	False	Челябинск	55.156682	61.302149	Челябинск, посёлок Шершни, Северная улица, 48А	От 3 до 6 лет	Полный день	Полная занятость	HTML5_CSS3_JavaScript_Git_React	False	UNIT6		300000.0	False	RUR
False	Android developer / android разработчик (Kotlin)	False	N/A	N/A	N/A	N/A	От 1 года до 3 лет	Полный день	Полная занятость	Kotlin_Git_Linux_Android_Android SDK	False	Медиа Онлайн	120000.0	175000.0	False	RUR
