premium	name	response_letter_required	city	latitude	longtitude	raw	experience	schedule	employment	skills	has_test	employer	salary_from	salary_to	gross	currency
False	Инженер-программист	False	Ставрополь	45.054907	42.007235	Ставрополь, Заводская улица, 9	От 1 года до 3 лет	Полный день	Полная занятость	Пользователь ПК_Работа в команде_Pascal_MS Visual C++_MS Word_Микроконтроллер_Программирование_AutoCAD_Compass 3D_Грамотная речь	False	Электроавтоматика	33000.0		False	RUR
False	Дизайнер-верстальщик	False	Казань	55.789816	49.106459	Казань, Московская улица, 26/31	От 3 до 6 лет	Полный день	Полная занятость		False	Полиграфычъ - Казань	40000.0	45000.0	False	RUR
False	Инженер 2-ой линии техподдержки\системный администратор	False	Москва	55.78978	37.732341	Москва, Мироновская улица, 33с26	От 3 до 6 лет	Полный день	Полная занятость	Zabbix_Microsoft_VMware_Linux_Active Directory_MS Exchange_WSUS_netbackup_Hypersonic Sql_SCCM_SCOM_Nagios_RDS_Настройка DNS	False	Инфосэл	100000.0		True	RUR
False	Программист-разработчик 1с	False	N/A	N/A	N/A	N/A	От 1 года до 3 лет	Полный день	Полная занятость	1С: Документооборот_1С программирование_1С: Управление Производственным Предприятием_Оптимизация кода_1С: ERP_1С: Предприятие 8	False	ГК Альфа	100000.0		False	RUR
False	Специалист по общестроительным работам	False	Белгород	50.589988	36.58539	Белгород, Харьковская улица, 8А	От 1 года до 3 лет	Полный день	Полная занятость	Умение работать в команде_Обеспечение жизнедеятельности офиса	False	Агро-Белогорье, Группа Компаний	32000.0	39400.0	True	RUR
False	Техник АСУ	False	Казань	55.752268	49.171919	Казань, Карбышева, 12А	Нет опыта	Полный день	Полная занятость	Пользователь ПК_Поиск информации в интернет_Точность и внимательность к деталям_Аналитические способности_Терпеливость	False	Межрегиональный клинико-диагностический центр (МКДЦ)	30000.0	30000.0	False	RUR
False	Инженер по тестированию ПО	False	N/A	N/A	N/A	N/A	От 3 до 6 лет	Полный день	Полная занятость	Функциональное тестирование_Jmeter_Test case_Тестирование пользовательского интерфейса_Тестирование_Удаленная работа_Postman_Основы программирования_SQL	False	Среда Капитал	80000.0		False	RUR
False	Оператор ЧПУ с программным управлением	False	Краснодар	45.013409	38.996738	Краснодар, микрорайон Черёмушки, улица Вишняковой, 2	От 3 до 6 лет	Полный день	Полная занятость	AutoCAD_ArtCAM_Компас_Станки ЧПУ_Уверенный пользователь ПК_Чтение чертежей_Exсel	False	Азимут	65000.0		False	RUR
False	Продавец-механик (ремонт спортивных товаров)	False	Краснодар	45.080326	39.014569	Краснодар, Российская улица, 131/5	Нет опыта	Полный день	Полная занятость		False	Байк Центр	36000.0		False	RUR
False	Инженер информационных технологий	False	Краснодар	45.036375	39.023687	Краснодар, Школьный микрорайон, Школьная улица, 36	Нет опыта	Полный день	Полная занятость	Настройка ПК_Настройка ПО_Настройка сетевых подключений_Работа в команде_Техническое обслуживание_Администрирование_Администрирование серверов_Администрирование серверов Windows_Автоматизированное рабочее место (АРМ)_Ремонт ПК_MS Dos_Установка ПО_Настройка оборудования	False	ГРЧЦ, ФГУП	29930.0	44895.0	True	RUR
False	Ведущий инженер-программист (ПЛИС)	False	Санкт-Петербург	59.88999	30.324564	Санкт-Петербург, улица Коли Томчака, 9	От 1 года до 3 лет	Полный день	Полная занятость	Altium Designer_Qt_Verilog HDL_C/C++	False	АО ЗАСЛОН	100000.0		False	RUR
False	Дежурный техник-электрик на пищевое производство	False	Москва	55.836231	37.550774	Москва, улица Прянишникова, 23А	От 1 года до 3 лет	Полный день	Полная занятость	Ремонтные работы_Монтаж оборудования_Техническое обслуживание_Электротехнические работы_Слесарные работы	False	Сеть кофеен Шоколадница	57000.0	60000.0	False	RUR
False	Главный консультант (программист)	False	Кемерово	55.3544	86.089632	Кемерово, Советский проспект, 62	Нет опыта	Полный день	Полная занятость		False	Министерство Жилищно-Коммунального и Дорожного Комплекса Кузбасса	44000.0	48000.0	False	RUR
False	Сервисный Инженер	False	Таганрог	47.242093	38.889497	Таганрог, Большая Бульварная улица, 11	От 1 года до 3 лет	Полный день	Полная занятость	Высокая энергичность и инициативность_Локальные сети_Internet_Умение находить общий язык_Настройка сетевых подключений	False	ПЖ19	35000.0		True	RUR
False	Стажер аналитического отдела противодействия современным угрозам ИБ	False		0.0	0.0	Санкт-Петербург, Малоохтинский проспект, 64	Нет опыта	Полный день	Полная занятость	Информационная безопасность_Английский язык_Информационные технологии_MS PowerPoint_Аналитическое мышление	False	Банк Санкт-Петербург		40000.0	True	RUR
False	ИТ-директор	False	N/A	N/A	N/A	N/A	От 3 до 6 лет	Полный день	Полная занятость	1С программирование_1С: Управление Производственным Предприятием_1С: Предприятие 8_SQL_1С: Зарплата и управление персоналом	False	Выбор	250000.0		False	RUR
False	Экономист	False	Ярославль	57.645074	39.874643	Ярославль, улица Полушкина Роща, 1	От 1 года до 3 лет	Полный день	Полная занятость	Анализ затрат_Работать в команде_Высшее образование_Работа в условиях многозадачности_Ответственность и исполнительность	False	Вершина	35000.0		True	RUR
False	Токарь 5-6 разряд	False	Екатеринбург	56.710564	60.57251	Екатеринбург, Полевской тракт, 16-й километр	Более 6 лет	Полный день	Полная занятость	Работа в команде_Грамотная речь_Умение работать в коллективе_Опытный пользователь ПК	False	Новосельцев Леонид Михайлович	80000.0		False	RUR
False	Специалист технической поддержки	False	Пермь	57.99787	56.23716	Пермь, улица Елькина, 3	От 1 года до 3 лет	Полный день	Полная занятость		False	Персис	35000.0	45000.0	False	RUR
False	Системный администратор (IT, защита информации)	False	Санкт-Петербург	59.913208	30.324222	Санкт-Петербург, Бронницкая улица, 32	От 1 года до 3 лет	Полный день	Полная занятость	Пользователь ПК	False	Санкт-Петербургское государственное бюджетное учреждение Горжилобмен	60000.0		False	RUR
False	Начальник автоколонны	False	N/A	N/A	N/A	N/A	От 3 до 6 лет	Полный день	Полная занятость	Заключение договоров_Руководство коллективом_Оптимизация затрат_Документооборот	False	АЛМАЗ		120000.0	False	RUR
False	Младший системный администратор	False	N/A	N/A	N/A	N/A	От 1 года до 3 лет	Полный день	Полная занятость	Сборка ПК_Настройка ПК_Техническое обслуживание_Настройка ПО_Ремонт ПК	False	ЖТЭК	50000.0		True	RUR
False	Инженер по защите информации	False	N/A	N/A	N/A	N/A	Нет опыта	Полный день	Полная занятость	Пользователь ПК_Работа в команде_Грамотная речь_Должностные инструкции_Поиск информации в интернет	False	ГБУЗ СК Городская поликлиника г. Ессентуки	20000.0		True	RUR
False	Разработчик и администратор баз данных MSSQL	False	Красноярск	56.01008	92.838567	Красноярск, проспект Мира, 115Ас1	От 1 года до 3 лет	Полный день	Полная занятость	Transact-SQL_MS SQL Server_SQL_Базы данных_MS SQL	False	Максбонус	80000.0	120000.0	False	RUR
False	Ведущий программист 1С	False	N/A	N/A	N/A	N/A	От 3 до 6 лет	Полный день	Полная занятость	1С программирование_JavaScript_ООП_jQuery_1С: Комплексная автоматизация_1С: Управление Торговлей_1С: Зарплата и управление персоналом_1С: Управление Производственным Предприятием_1С: Документооборот_ERP_Знание 1С	False	СПУТНИК-Персонал	220000.0	230000.0	False	RUR
False	Журналист в корпоративную газету Монди СЛПК	False	Сыктывкар	61.815393	50.735257	Сыктывкар, проспект Бумажников, 2	От 1 года до 3 лет	Полный день	Полная занятость	Написание статей_Написание текстов_Грамотность_Корректура текстов_Многозадачность	False	Премьер'с Коммуникации		50000.0	False	RUR
False	Инженер / системный администратор (центр ИТ)	False	Москва	55.775272	37.738629	Москва, Вольная улица, 30	Нет опыта	Полный день	Полная занятость	Английский язык_Информационные технологии	False	Корпорация ВНИИЭМ	62000.0		True	RUR
False	Зуборезчик (фрезеровщик)	False	Набережные Челны	55.656692	52.310624	Набережные Челны, Профильная улица, 90	От 1 года до 3 лет	Полный день	Полная занятость		False	Сатурн	50000.0		True	RUR
False	Программист 1С	False	Екатеринбург	56.815203	60.623813	Екатеринбург, улица Цвиллинга, 6	От 1 года до 3 лет	Полный день	Полная занятость	1С программирование	False	ЕРП ЦЕНТР	80000.0		False	RUR
False	Шлифовщик по металлу	False	N/A	N/A	N/A	N/A	От 3 до 6 лет	Полный день	Полная занятость	оформление документации_Материальная ответственность_Навыки составления отчетности_проведение опросов общественного мнения	False	Группа компаний Система	85000.0	100000.0	False	RUR
False	Фрезеровщик	False	N/A	N/A	N/A	N/A	От 1 года до 3 лет	Полный день	Полная занятость	Умение работать в команде_Гарантийное обслуживание_Внимательность, ответственность_обработка инструментов_фрезерная обработка	False	Энергокабель, Завод		115000.0	True	RUR
False	Программист С#	False	N/A	N/A	N/A	N/A	От 1 года до 3 лет	Полный день	Полная занятость		False	Агентство КИТ Консалт	70000.0	120000.0	False	RUR
False	Программист 1С	False	N/A	N/A	N/A	N/A	Нет опыта	Полный день	Полная занятость	1С программирование	False	ЗиО-Здоровье	110000.0	130000.0	True	RUR
False	Токарь	False	N/A	N/A	N/A	N/A	От 1 года до 3 лет	Полный день	Полная занятость	Точность и внимательность к деталям_Умение планировать_Металлообработка_Чтение чертежей	False	Консалтинг Групп	110000.0		False	RUR
False	Техник по слаботочным системам	False	N/A	N/A	N/A	N/A	Нет опыта	Полный день	Полная занятость	Пожарная безопасность_AutoCAD_Инженерные системы_слаботочные системы_Выездное обслуживание	False	Компас	25000.0	60000.0	False	RUR
False	Токарь универсал	False	г. Щёлково Московской области	55.9061458442	38.0385522777	г. Щёлково Московской области, Заводская, 14	От 3 до 6 лет	Полный день	Полная занятость		False	ЭНА	90000.0		False	RUR
False	Дизайнер	False	Новосибирск	55.039863	82.9358	Новосибирск, улица Ломоносова, 53/1	От 1 года до 3 лет	Полный день	Полная занятость	Adobe Illustrator_Adobe Photoshop_Графический дизайн_Дизайн_Креативность	False	НЛ Континент	80000.0		False	RUR
False	Middle Backend Engineer (Python)	False	N/A	N/A	N/A	N/A	От 3 до 6 лет	Полный день	Полная занятость	Python_PostgreSQL_SQL_Big Data_Анализ данных_Kafka_RabbitMQ_SOA_BPMN_Camunda_PostGIS_Node.js_Nest.js_ГИС_GIS_Data Science_System Architecture	False	Тазмар	150000.0	250000.0	False	RUR
False	Системный администратор	False	N/A	N/A	N/A	N/A	От 3 до 6 лет	Полный день	Полная занятость		False	КДВ Групп	60000.0	60000.0	False	RUR
False	Специалист поддержки ассортимента	False		0.0	0.0	г. Краснодар улица Солнечная 15/5	Нет опыта	Полный день	Полная занятость	Грамотная речь_Работа в команде_Аналитическое мышление_SQL_MS Excel	False	МАГНИТ, Розничная сеть		39000.0	True	RUR
False	Тестировщик / QA-инженер	False	Самара	53.213342	50.18759	Самара, проспект Карла Маркса, 201Б	От 1 года до 3 лет	Полный день	Полная занятость	Postman_Функциональное тестирование_Тестирование_Test case_Тестирование пользовательского интерфейса	False	Demis Group		50000.0	True	RUR
False	Web developer (back end)	False					От 3 до 6 лет	Полный день	Полная занятость	PHP_ООП_JavaScript_MySQL_HTML_CSS_ReactJS_Vue.js_Svn, Git	False	FITNESS HOUSE	110000.0		False	RUR
False	Токарь	False	Краснодар	45.068366	38.994447	Краснодар, микрорайон Завод Измерительных Приборов, улица Тополиная Аллея, 3	От 1 года до 3 лет	Полный день	Полная занятость		False	ОЧАКОВО	45000.0	45000.0	True	RUR
False	Токарь-универсал	False	N/A	N/A	N/A	N/A	От 1 года до 3 лет	Полный день	Полная занятость		False	Кадровое агентство Приоритет	45000.0	60000.0	False	RUR
False	Аналитик отдела закупок собственной торговой марки	False	Нижний Новгород	56.307122	44.059661	Нижний Новгород, улица Деловая, 7	От 1 года до 3 лет	Полный день	Полная занятость	Анализ продаж_Продажи_Привлечение клиентов	False	Компания IXORA		80000.0	True	RUR
False	Сервисный инженер ЧПУ (металлообработка)	False	N/A	N/A	N/A	N/A	От 3 до 6 лет	Полный день	Полная занятость	Станки ЧПУ_Фрезерные станки_Токарные станки_Автоматы продольного точения_Ленточнопильные станки_Электроэрозионные станки_Вальцы	False	Ассоциация КАМИ	110000.0	150000.0	False	RUR
False	Руководитель отдела разработки ПО	False	Томск	56.48126	84.947271	Томск, улица Алексея Беленца, 9/1	От 3 до 6 лет	Полный день	Полная занятость	MS SQL_C#_Управление персоналом_Подбор персонала	False	Loymax	140000.0		False	RUR
False	Оператор-наладчик фрезерных и токарных станков	False	N/A	N/A	N/A	N/A	От 1 года до 3 лет	Полный день	Полная занятость		False	РИМО	50000.0	100000.0	False	RUR
False	Оператор - наладчик оборудования	False	Дубна	56.759414	37.16846	Дубна, проспект Науки, 13	От 1 года до 3 лет	Полный день	Полная занятость		False	Эверс	35000.0	45000.0	False	RUR
False	Директор по информационным технологиям/CIO/Технический Директор/CTO	False	Новосибирск	55.006296	82.948547	Новосибирск, улица Добролюбова, 10/2	Более 6 лет	Полный день	Полная занятость	Управление проектами_Бизнес-анализ_Управление бизнес процессами_Лидерство_BPM	False	Би Джи Эр Солюшенс	250000.0		False	RUR
False	Заместитель начальника отдела технической поддержки и системного администрирования	False	Екатеринбург	56.816419	60.600385	Екатеринбург, улица Большакова, 105	От 3 до 6 лет	Полный день	Полная занятость	Английский язык_Деловая переписка_Электронный документооборот_Техническая поддержка_Windows	False	ГБУ СО Оператор электронного правительства	70000.0		False	RUR
False	Инженер/техник по обслуживанию пожарной сигнализации и противопожарных систем (ОПС и СОУЭ)	False	Домодедово	55.463967	37.762587	Домодедово, микрорайон Центральный, территория Трио-Инвест-Ям, с1	От 1 года до 3 лет	Полный день	Полная занятость		False	Меридиан	70000.0	80000.0	False	RUR
False	Java Software Engineer	False	N/A	N/A	N/A	N/A	От 3 до 6 лет	Полный день	Полная занятость	Java_Spring Framework_Git_PHP_MySQL_ООП_Английский язык	False	X-Cart (ООО Креативные Технологии)	150000.0	250000.0	False	RUR
False	Механик гаража	False	Искитим	54.641258	83.304873	Искитим, Вокзальная улица, 1А	От 1 года до 3 лет	Полный день	Полная занятость	Документальное сопровождение_Умение работать в команде_Деловая переписка_Управление офисными водителями_Ведение документации	False	Искитимский отдел вневедомственной охраны-филиал ФГКУ УВО ВНГ России по Новосибирской области	23000.0		False	RUR
False	Сервисный инженер (Саранск)	False	N/A	N/A	N/A	N/A	От 1 года до 3 лет	Полный день	Полная занятость		False	Ростелеком	30000.0		False	RUR
False	Руководитель направления информационной безопасности	False	N/A	N/A	N/A	N/A	От 1 года до 3 лет	Полный день	Полная занятость	Информационная безопасность_Проведение внутренних расследований_Управление командой	False	Ростелеком	100000.0		False	RUR
False	Токарь-карусельщик	False	N/A	N/A	N/A	N/A	От 3 до 6 лет	Полный день	Полная занятость	оформление документации_Материальная ответственность_Навыки составления отчетности_проведение опросов общественного мнения	False	Группа компаний Система	105000.0		False	RUR
False	Руководитель отдела информационных технологий (Руководитель IT отдела)	False	Москва	55.747079	37.536589	Москва, Пресненская набережная, 10блокС	От 3 до 6 лет	Полный день	Полная занятость	Mac Os_Настройка ПО_Закупка оргтехники и оборудования_Active Directory_Windows Os_Системное администрирование_Информационные технологии_Системный подход_Информационная безопасность_Системное мышление_Управление проектами_Управление процессами	True	Бастион		300000.0	False	RUR
False	Инженер по ремонту компьютеров	False	Москва, ст.м. Пролетарская	55.732017	37.667788	Москва, ст.м. Пролетарская, Волгоградский пр., 2	От 1 года до 3 лет	Полный день	Полная занятость	Работа с оргтехникой_Ремонт ПК	False	РАМЭК - ВС	95000.0	95000.0	True	RUR
False	Администратор баз данных	False	Москва	55.734445	37.615434	Москва, 1-й Хвостов переулок, 11а	От 3 до 6 лет	Полный день	Полная занятость		False	ФинТех	150.0	250.0	False	RUR
False	Ведущий специалист отдела развития муниципальной экономики	False	Старый Оскол	51.297653	37.834273	Старый Оскол, улица Ленина, 39	От 1 года до 3 лет	Полный день	Полная занятость	Работа с большим объемом информации_Поиск информации в интернет_Аналитические навыки_Подготовка презентаций_Internet_Создание презентационных материалов о компании_Сбор и анализ информации_MC Excel	False	Администрация Старооскольского городского округа	18000.0	23000.0	True	RUR
False	Инженер-программист (Конструкторско-технологический отдел)	False	сельский посёлок Плеханово	54.243314	37.57068	сельский посёлок Плеханово, Заводская улица, 1	От 1 года до 3 лет	Полный день	Полная занятость	Работа с людьми_ЕСКД	False	Тулаэлектропривод	40000.0		True	RUR
