premium	name	response_letter_required	city	latitude	longtitude	raw	experience	schedule	employment	skills	has_test	employer	salary_from	salary_to	gross	currency
False	Разработчик C#	False	Зеленоград	55.98224	37.214274	Зеленоград, площадь Шокина, 2с3	От 3 до 6 лет	Полный день	Полная занятость	Средства криптографической защиты информации_Linux_C/C++_MVC_JSON_ASP.NET Core_.NET Core_C#_Interoperability	False	АНГСТРЕМ	150000.0		False	RUR
False	С++/C# программист Middle	False	Новосибирск	54.851941	83.101889	Новосибирск, Советский район, микрорайон Академгородок	От 1 года до 3 лет	Полный день	Полная занятость	ООП_C++_C#	False	СофтЛаб-НСК	90000.0		False	RUR
False	Монтажник слаботочных систем (систем безопасности, видеонаблюдения, СКУД, ОПС, IT технологии)	False	N/A	N/A	N/A	N/A	От 3 до 6 лет	Полный день	Полная занятость	монтаж СВН_монтаж ОПС_монтаж слаботочных сетей_монтаж СКУД_Пуско-наладочные работы_слаботочные системы_строительно-монтажные работы_система видеонаблюдения_охранно-пожарная-сигнализация_Гарантийное обслуживание_система контроля и управления доступом	False	Группа компаний LUXCOM	70000.0	110000.0	False	RUR
False	Ведущий программист 1С	False	Хабаровск	48.403097	135.103295	Хабаровск, Краснореченская улица, 62	От 1 года до 3 лет	Полный день	Полная занятость	1С: Предприятие 8_1С: Комплексная автоматизация_1C: Финансы_Автоматизация медицинских процессов_1C: Предприятие	False	Центр Медицинских Комиссий	180000.0		False	RUR
False	Механик по выпуску автотранспорта	False	N/A	N/A	N/A	N/A	От 1 года до 3 лет	Полный день	Полная занятость	Пользователь ПК_Ведение документации_Поиск информации в интернет_Взаимодействие с Ростехнадзором_Желание работать и зарабатывать	False	Северная Транспортная Компания	100000.0		False	RUR
False	Специалист технической поддержки (быстрый рост до project-менеджера)	False	Москва	55.791253	37.587542	Москва, Бумажный проезд, 14с1	От 1 года до 3 лет	Полный день	Полная занятость	SQL_Atlassian Jira_Анализ данных_Helpdesk_Техническая поддержка_MS Excel_Trello	False	Привет, Интернет	70000.0	100000.0	False	RUR
False	Младший программист 1С	False	N/A	N/A	N/A	N/A	Нет опыта	Полный день	Полная занятость	1С программирование_Аналитическое мышление_Уверенный пользователь ПК	False	Химиндустрия	50000.0	80000.0	False	RUR
False	Программист C/C++	False	N/A	N/A	N/A	N/A	От 3 до 6 лет	Полный день	Полная занятость	C++_Linux_ООП_TCP/IP_Английский язык_C_Git	False	Экран	120000.0	140000.0	True	RUR
False	Специалист по написанию текстов (автомобильная отрасль)	False	Волжский	48.794585	44.753439	Волжский, улица имени Космонавтов, 16Б	Нет опыта	Полный день	Полная занятость	Копирайтинг_Грамотность_Грамотная речь_Работа в команде_Написание текстов_Работа с большим объемом информации_Поиск информации в интернет	True	Соцмедиамаркетинг	25000.0	25000.0	False	RUR
False	Golang Developer | Golang middle+/senior	False	N/A	N/A	N/A	N/A	От 3 до 6 лет	Полный день	Полная занятость	Git_PostgreSQL_Linux_Atlassian Jira_Go_Docker_Микросервисная архитектура_Golang	False	Сеть Партнерств	300000.0		False	RUR
False	Помощник системного администратора	False	Новосибирск	55.0571991758	82.9135072196	Новосибирск, Красный проспект, 182/1	От 1 года до 3 лет	Полный день	Полная занятость	TCP/IP_Windows 7_Офисная техника_Сборка ПК	False	КОТЭС Инжиниринг	40000.0		False	RUR
False	Web Аналитик / Маркетолог	False	Тюмень	57.1217490665	65.5498001679	Тюмень, улица Мельникайте, 137	От 1 года до 3 лет	Полный день	Полная занятость	Google Analytics_HTML_Яндекс.Метрика_CSS_Google Tag Manager	False	Lead.Media	30000.0	70000.0	False	RUR
False	Инженер-программист 1 категории	False	Москва	55.767428	37.64966	Москва, Хоромный тупик, 4	От 3 до 6 лет	Полный день	Полная занятость	Английский язык_MATLAB_Математическое программирование_Mathcad_MS Visual Studio	False	Корпорация ВНИИЭМ	90000.0		True	RUR
False	Фрезеровщик 4-5 разряда	False	Уфа	54.836114	56.114836	Уфа, улица Свободы, 86/10	От 1 года до 3 лет	Полный день	Полная занятость	Фрезеровщик	False	Уфимский Завод Бурового Оборудования	50000.0		False	RUR
False	Рабочий по комплексному обслуживанию зданий	False	Ангарск	52.518473	103.861048	Ангарск, Гражданская улица, 7	От 1 года до 3 лет	Полный день	Полная занятость	Пользователь ПК_Работа в команде_Творческое мышление_Оперативный поиск информации в сети Интернет_Google Chrome	False	Филиал ОГУЭП Облкоммунэнерго Ангарские электрические сети		26700.0	False	RUR
False	Оператор плазменной резки	False	Набережные Челны	55.683874	52.274404	Набережные Челны, Авторемонтная улица, 25	От 1 года до 3 лет	Полный день	Полная занятость		False	ЭКСПРЕСС	40000.0	70000.0	False	RUR
False	Фрезеровщик	False	N/A	N/A	N/A	N/A	От 1 года до 3 лет	Полный день	Полная занятость	Работа в команде_Универсальность	False	Группа компаний Система	109000.0		False	RUR
False	Инженер	False	N/A	N/A	N/A	N/A	От 3 до 6 лет	Полный день	Полная занятость	Ремонт ПК_Настройка сетевых подключений_MS Visio_Windows 7_Ремонт телеметрии_Схемотехника электронного оборудования_Контроль исправности оборудования_Автоматизация технологических процессов_Ремонт электроники_Техническое обслуживание_Системы газоснабжения_Учет газа	False	Газпром межрегионгаз инжиниринг	60000.0		True	RUR
False	Оператор станков с ЧПУ (трубопроводное производство)	False	Нижний Новгород	56.3211764188	43.8946352646	Нижний Новгород, проспект Героев	От 1 года до 3 лет	Полный день	Полная занятость	Пользователь ПК_Работа в команде_Чтение чертежей_оформление документации_Internet	False	Современные Трубопроводные Системы	50000.0		False	RUR
False	Разработчик 1С	False	N/A	N/A	N/A	N/A	От 1 года до 3 лет	Полный день	Полная занятость	1С: Управление Торговлей_1С программирование_1С: Бухгалтерия_1С: Предприятие 8_1С: Зарплата и управление персоналом	False	Аверина Наталья Анатольевна	60000.0	60000.0	False	RUR
False	Наладчик оборудования	False	Москва	55.712827	37.418524	Москва, Дорогобужская улица, 14	От 1 года до 3 лет	Полный день	Полная занятость	Пуско-наладочные работы	False	Мосточлегмаш	50000.0		True	RUR
False	Старший программист 1С	False	Владивосток	43.193977	131.934623	Владивосток, улица Маковского, 7Б	От 1 года до 3 лет	Полный день	Полная занятость	1С программирование_1С: Зарплата и управление персоналом_1С: Предприятие 8_1С: Управление Торговлей_1С: Бухгалтерия	False	Центр детского здоровья	120000.0	150000.0	False	RUR
False	Программист 1С	False	N/A	N/A	N/A	N/A	От 3 до 6 лет	Полный день	Полная занятость	1С: Розница_1С программирование	False	1221Системс	150000.0	180000.0	True	RUR
False	Электромеханик	False	Нижний Новгород	56.271625	43.94429	Нижний Новгород, Памирская улица, 11	От 1 года до 3 лет	Полный день	Полная занятость	Монтаж оборудования_Техническое обслуживание_Электротехнические работы_Ремонтные работы	False	ЕвроСид	50000.0	60000.0	False	RUR
False	Системный администратор	False	Новочебоксарск	56.092943	47.498187	Новочебоксарск, Восточная , 6	От 3 до 6 лет	Полный день	Полная занятость	1С: Предприятие 8_Работа с оргтехникой_Администрирование_1С программирование	False	Чебоксары Лада	45000.0		True	RUR
False	Фрезеровщик	False	Новосибирск	54.942035	82.906596	Новосибирск, улица Петухова, 69к4	От 1 года до 3 лет	Полный день	Полная занятость		False	Сибэлектропривод	40000.0		False	RUR
False	Механик цеха	False				г. Воронеж, ул. Кольцовская, д. 40	От 3 до 6 лет	Полный день	Полная занятость		False	Воронежская кондитерская фабрика	50000.0		True	RUR
False	Системный администратор	False	N/A	N/A	N/A	N/A	Нет опыта	Полный день	Полная занятость	Администрирование серверов Windows_Администрирование сетевого оборудования_Настройка сетевых подключений_Монтаж оборудования_Linux	False	МАГНИТ, Розничная сеть		50000.0	False	RUR
False	Токарь	False	N/A	N/A	N/A	N/A	Нет опыта	Полный день	Полная занятость	Точность и внимательность к деталям_Ориентация на результат	False	Комбинат КМАруда	50000.0	65000.0	True	RUR
False	Оператор станков с ЧПУ	False	Череповец	59.131617	37.968966	Череповец, улица Краснодонцев, 3Б	От 1 года до 3 лет	Полный день	Полная занятость	Чтение чертежей_Работа с чертежами_Грамотность_Пользователь ПК_Ответственность и пунктуальность	False	Электротехнический завод Эльком	40000.0	60000.0	True	RUR
False	Менеджер по продажам сетевого оборудования	False	Санкт-Петербург	60.0003199237	30.3156602784	Санкт-Петербург, улица Матроса Железняка, 57	От 1 года до 3 лет	Полный день	Полная занятость	Активные продажи_Пользователь ПК_Деловое общение_Организация встреч_Работа в команде	False	Модуль	80000.0		False	RUR
False	Ведущий специалист отдела системного и сетевого администрирования	False	Петропавловск-Камчатский	53.065907	158.588976	Петропавловск-Камчатский, улица Арсеньева, 23	От 3 до 6 лет	Полный день	Полная занятость	Linux_VMware_Английский язык_Cisco_Умение принимать решения	False	КГАУ Информационно-технологический центр Камчатского края	68000.0	75000.0	False	RUR
False	Заведующий сектором культурных программ библиотеки «Ржевская»	False	Санкт-Петербург	59.954232	30.469866	Санкт-Петербург, Индустриальный проспект, 35к1	От 1 года до 3 лет	Полный день	Полная занятость	Креативность_Грамотная речь_Деловая коммуникация_Навыки презентации_Организаторские навыки_Ведение переговоров_Генерация идей	False	СПб ГБУК Централизованная библиотечная система Красногвардейского района	54000.0	66000.0	True	RUR
False	Middle Python Developer	False	N/A	N/A	N/A	N/A	От 1 года до 3 лет	Полный день	Полная занятость	Python_Django Framework_API_JavaScript_Github_PostgreSQL	False	Remokate	130000.0	250000.0	False	RUR
False	Токарь-расточник	False	N/A	N/A	N/A	N/A	От 1 года до 3 лет	Полный день	Полная занятость		False	Регро	106000.0	108000.0	False	RUR
False	Журналист	True	Улан-Удэ	51.833239	107.590171	Улан-Удэ, улица Борсоева, 13/2	От 1 года до 3 лет	Полный день	Полная занятость	Написание текстов_Грамотное письмо_Ответственность и пунктуальность	True	БАЙКАЛ ДЕЙЛИ	30000.0	50000.0	True	RUR
False	Электромонтер охранно-пожарных сигнализаций и систем оповещения при пожаре	False	Уфа	54.732028	55.987518	Уфа, Владивостокская улица, 10	От 1 года до 3 лет	Полный день	Полная занятость	Мобильность_Умение планировать_Опытный пользователь ПК_Коммуникабельность, стрессоустойчивость_Работать в команде_Умение общаться с людьми_Ответственность и исполнительность_Умение эффективно планировать свое время_Опрятность_Умение слушать_Желание работать и зарабатывать_Умение общаться с клиентами_Желание работать и развиваться_Работа в команде_Грамотная речь	False	Частная Охранная организация Медведи	45000.0	70000.0	False	RUR
False	Специалист систем видеонаблюдения, СКУД, домофонии	False	Батайск	47.157939	39.747469	Батайск, улица Северная Звезда, 10к1	От 3 до 6 лет	Полный день	Полная занятость		False	СК Анастасия	46000.0	46000.0	False	RUR
False	Консультант 1C	False	Тула	54.191289	37.589293	Тула, улица Демонстрации, 38В	От 1 года до 3 лет	Полный день	Полная занятость	Обновление конфигурации 1С_1C: Бухгалтерия_Многозадачность_1C: Предприятие_Желание учиться и развиваться_Опыт работы в 1С_Внедрение ПО	False	Гильдия консультантов	45000.0	130000.0	True	RUR
False	Ведущий инженер отдела внедрения интеллектуальных систем учета	False	Новосибирск	55.021571	82.91725	Новосибирск, Советская улица, 5	От 1 года до 3 лет	Полный день	Полная занятость		False	Акционерное общество «Региональные электрические сети»	38500.0	43200.0	False	RUR
False	Копирайтер/smm-менеджер	False	Краснодар	45.049806	38.977415	Краснодар, Красная улица, 155/2	От 1 года до 3 лет	Полный день	Полная занятость	Копирайтинг_Написание текстов_Грамотность_Написание статей_SMM	False	Vals.digital	50000.0		False	RUR
False	Техник	False	Красноярск	55.976524	92.860387	Красноярск, Парашютная улица, 3	Нет опыта	Полный день	Полная занятость	MS Internet Explorer_Технические системы и средства безопасности_Системы охранно-тревожной сигнализации_Системы безопасности	False	ФКУ ИК-6 ГУФСИН России по Красноярскому краю	35000.0		False	RUR
False	Токарь	False	N/A	N/A	N/A	N/A	От 1 года до 3 лет	Полный день	Полная занятость	Металлообработка_Массовое производство_Умение читать чертежи	False	Фобос+	70000.0		False	RUR
False	Специалист по технической поддержке	False	Псков	57.831174	28.345144	Псков, улица Белинского, 74	Нет опыта	Полный день	Полная занятость	Грамотная речь_Пользователь ПК	False	Контакт Сервис	35000.0	45000.0	False	RUR
False	Специалист по информационной безопасности	False	Нижний Новгород	56.292368	44.034724	Нижний Новгород, улица Ванеева, 203	От 1 года до 3 лет	Полный день	Полная занятость		False	ГБОУ ДПО Нижегородский институт развития образования	40000.0		True	RUR
False	Ведущий инженер-программист АСУТП	False	Уфа	54.749725	56.004595	Уфа, Комсомольская улица, 98	Более 6 лет	Полный день	Полная занятость	Готовность к командировкам_ПЛК_Разработка ПО_АСУ ТП_SCADA_нефтедобыча	False	Экситон - автоматика, НПФ	90000.0		False	RUR
False	Руководитель службы информационных технологий	False	деревня Новая Купавна	55.826781	38.096078	деревня Новая Купавна, микрорайон Родинки, Сиреневая улица, 21	От 1 года до 3 лет	Полный день	Полная занятость		False	Конгресс-отель Ареал	150000.0		False	RUR
False	Монтажник связи ОЛВС (инсталятор)	False	Красноярск	56.027072	92.780841	Красноярск, Высотная улица, 4	Нет опыта	Полный день	Полная занятость		False	Игра-Сервис	40000.0	70000.0	False	RUR
False	Инженер БДД	False	N/A	N/A	N/A	N/A	От 3 до 6 лет	Полный день	Полная занятость	Работа с базами данных_Документальное сопровождение_Офисная техника_Навыки составления отчетности_Безопасность дорожного движения	False	Х5 Transport	84000.0	84000.0	True	RUR
False	Системный администратор	False	Санкт-Петербург	59.940339	30.497516	Санкт-Петербург, Ленская улица, 18	От 1 года до 3 лет	Полный день	Полная занятость		False	Семишагофф		68000.0	True	RUR
False	Дизайнер-печатник	False	Барнаул	53.329171	83.804282	Барнаул, площадь Баварина, 2	От 3 до 6 лет	Полный день	Полная занятость	Adobe Photoshop_Пользователь ПК_MS PowerPoint_Internet	False	ПРЕСС-Т рекламно-производственная фирма	25000.0	35000.0	False	RUR
False	Наладчик технологического оборудования	False				Набережные Челны, Магистральная, 1 (здание бывшего Мясокомбината)	От 1 года до 3 лет	Полный день	Полная занятость	Работа в команде_Умение работать в команде_Навыки составления отчетности_Оперативный поиск информации в сети Интернет	False	Эссен Продакшн АГ	45000.0	45000.0	False	RUR
False	Резчик на пилах, ножовках и станках	False	Берёзовский	56.916281232	60.7763839534	Берёзовский, улица Первомайский поселок, 3	От 1 года до 3 лет	Полный день	Полная занятость		False	Березовский ремонтно-механический завод	55000.0		True	RUR
False	Консультант 1С в Службу заботы (удаленно)	False	Москва	55.692318	37.347485	Москва, Западный административный округ, Можайский район, Инновационный центр Сколково, Большой бульвар, 42с1	От 1 года до 3 лет	Полный день	Полная занятость	Английский язык_Системное мышление_Умение общаться с людьми_ERP-системы на базе 1С_1С: УНФ_1С: Комплексная автоматизация_1С: Управление предприятием_1С: Бухгалтерия_1С: Управление Торговлей_Сосредоточенность_Проведение презентаций_Системный подход_Автоматизация	False	iTeal	60000.0	110000.0	False	RUR
False	Инженер 1 категории Отдела главного механика Завода строительных материалов	False	N/A	N/A	N/A	N/A	От 1 года до 3 лет	Полный день	Полная занятость	Работа в команде_Строительный контроль_Техническая экспертиза_Производственное планирование_MS Outlook	False	Норникель	112000.0		True	RUR
False	Токарь / Токарь-расточник (Токарь-карусельщик)	False	N/A	N/A	N/A	N/A	От 3 до 6 лет	Полный день	Полная занятость	Работа в команде_Металлообработка_Стропальщик_Универсальность_Токарь	False	РостДжоб	80000.0	100000.0	False	RUR
False	Программист 1С	False				Казань, улица Пушкина, 13/52	От 3 до 6 лет	Полный день	Полная занятость		False	Энергобанк, АКБ	110000.0		False	RUR
False	Ведущий инженер-программист 1С	False	Санкт-Петербург	59.936305	30.275237	Санкт-Петербург, Большой проспект В.О., 36	От 3 до 6 лет	Полный день	Полная занятость	1С программирование	False	ЦКБ «Айсберг»	80000.0		False	RUR
False	Специалист службы технической поддержки	False	Санкт-Петербург	60.015251	30.410119	Санкт-Петербург, улица Софьи Ковалевской, 12к2	От 1 года до 3 лет	Полный день	Полная занятость	TCP/IP_Грамотная речь_Деловая переписка_Linux_Деловое общение	False	ЕТелеком	50000.0		False	RUR
