premium	name	response_letter_required	city	latitude	longtitude	raw	experience	schedule	employment	skills	has_test	employer	salary_from	salary_to	gross	currency
False	Программист 1С	False	Красноярск	56.018217	93.03714	Красноярск, улица Глинки, 37г	От 3 до 6 лет	Полный день	Полная занятость	Управление проектами_1С: Управление Торговлей_1С: Предприятие 8_1С: Управление Производственным Предприятием_1С: Документооборот	False	Водолей	120000.0		False	RUR
False	Ведущий специалист реализации инициатив социально-экономического развития	False	N/A	N/A	N/A	N/A	От 1 года до 3 лет	Полный день	Полная занятость	Статистический анализ_Деловая переписка_Креативность_Аналитические исследования_MS PowerPoint_Эконометрика	False	ФГБУК Роскультпроект	70000.0	93000.0	True	RUR
False	Монтажник РЭА и приборов	False	N/A	N/A	N/A	N/A	Нет опыта	Полный день	Полная занятость	Пайка_Пользователь ПК_Умение читать чертежи	False	НПО Алмаз	40000.0		True	RUR
False	Механик послегарантийного обслуживания	False	Благовещенск	50.305872	127.535267	Благовещенск, микрорайон КПП, Кольцевая улица, 61сА4	От 1 года до 3 лет	Полный день	Полная занятость	Выездное обслуживание_Техническое обслуживание_Работа в команде_Ремонтные работы_Ориентация на результат_Диагностика_Гарантийное обслуживание_Механик	False	БИГЦЕНТР	60000.0	65000.0	False	RUR
False	Фрезеровщик	False	N/A	N/A	N/A	N/A	От 1 года до 3 лет	Полный день	Полная занятость	Работа в команде_Грамотность_Точность и внимательность к деталям_Универсальность	False	Фобос+	80000.0		True	RUR
False	Программист 1С	False	N/A	N/A	N/A	N/A	От 1 года до 3 лет	Полный день	Полная занятость	1С программирование_1С: Документооборот_Знание 1С_1С: Управление предприятием	False	Южно-Уральский государственный университет	50000.0		False	RUR
False	Ведущий инженер по информационной безопасности (IT-компания)	False	Москва	55.71446	37.62431	Москва, Подольское шоссе, 8	От 1 года до 3 лет	Полный день	Полная занятость		False	ИНФОРМАЦИОННО-ВЫЧИСЛИТЕЛЬНЫЕ СИСТЕМЫ	90000.0		True	RUR
False	Программист/Специалист Helpdesk	False	Москва	55.818331	37.518282	Москва, улица Клары Цеткин, 7а	От 3 до 6 лет	Полный день	Полная занятость	Сопровождение клиентов_Автоматизация сборок_Опыт программирования_Опыт сопровождения ПО	False	ИНЭК	80000.0		True	RUR
False	Гейм-дизайнер	False	Санкт-Петербург	59.937968	30.320243	Санкт-Петербург, набережная реки Мойки, 36	От 1 года до 3 лет	Полный день	Полная занятость	Unity_Adobe Photoshop_Android_Английский язык_iOS	False	ЮГО	60000.0		False	RUR
False	Компьютерный мастер	False	N/A	N/A	N/A	N/A	От 1 года до 3 лет	Полный день	Полная занятость		False	Поляков Денис Иванович	80000.0		False	RUR
False	Программист SQL	False	Санкт-Петербург	59.867046	30.471609	Санкт-Петербург, проспект Обуховской Обороны, 112к2литЗ	От 1 года до 3 лет	Полный день	Полная занятость	WMS_Transact-SQL_MS SQL_MS SQL Server	False	Ле Муррр		180000.0	False	RUR
False	Системный администратор	False	Краснодар	45.052927	39.02234	Краснодар, Прикубанский округ, улица 1 Мая, 93	От 1 года до 3 лет	Полный день	Полная занятость	Пользователь ПК_Умение работать в коллективе	False	МАОУ СОШ № 93	23000.0	23000.0	True	RUR
False	Сетевой инженер (Сахалин)	False	N/A	N/A	N/A	N/A	От 3 до 6 лет	Полный день	Полная занятость	Cisco_BGP_VLAN_D-Link_STP	False	Восточная горнорудная компания	110000.0		False	RUR
False	Токарь-универсал	False	Александров	56.381225	38.704714	Александров, улица Гагарина, 2к8	От 3 до 6 лет	Полный день	Полная занятость		False	АЗКПО	35000.0	60000.0	False	RUR
False	Электромеханик связи (Хадыженск)	False	N/A	N/A	N/A	N/A	От 1 года до 3 лет	Полный день	Полная занятость		False	Связьтранснефть	35000.0	45000.0	False	RUR
False	Ведущий проектировщик пользовательских интерфейсов (UI/UX)	False	N/A	N/A	N/A	N/A	От 3 до 6 лет	Полный день	Полная занятость	Аналитическое мышление_Креативность_Графические редакторы_UX_Axure RP	False	Тензор	160000.0	260000.0	True	RUR
False	Оператор станков с ЧПУ	False	Тутаев	57.847913	39.514751	Тутаев, Промышленная улица, 27	Нет опыта	Полный день	Полная занятость		False	СПТК АРМТТ	40000.0		False	RUR
False	Инженер отдела информационного обеспечения	False		0.0	0.0	г.Уфа, Ленина, 70	От 1 года до 3 лет	Полный день	Полная занятость		False	Россельхозбанк	25800.0	30000.0	False	RUR
False	Преподаватель	False	Йошкар-Ола	56.643277	47.87424	Йошкар-Ола, улица Машиностроителей, 15	От 1 года до 3 лет	Полный день	Полная занятость	Пользователь ПК_Работа в команде_Поиск информации в интернет_Математическое программирование	False	ФГБОУ ВО Марийский государственный университет	24990.0		False	RUR
False	Менеджер по работе с проектными организациями / Инженер по продажам	False	Липецк	52.601393	39.462928	Липецк, посёлок Сырский, Ангарская улица, вл34	От 1 года до 3 лет	Полный день	Полная занятость	Активные продажи_AutoCAD_Проведение презентаций_Ориентация на результат_Поиск и привлечение клиентов	False	СТАНДАРТПАРК	75000.0		False	RUR
False	Монтажник ОПС/Техник ОПС (Слаботочные системы)	False	N/A	N/A	N/A	N/A	Нет опыта	Полный день	Полная занятость	Системы охранно-тревожной сигнализации_Системы видеонаблюдения_Умение работать в коллективе_Пожарная сигнализация_Системы безопасности_слаботочные системы_Контроль доступа_Электрические системы и слаботочные системы_Монтаж инженерных систем_Монтаж оборудования_монтаж	False	Дельта системы безопасности	60000.0		False	RUR
False	Senior Java Developer / Главный Java разработчик	False	Москва	55.7209	37.651268	Москва, Дербеневская набережная, 11	От 3 до 6 лет	Полный день	Полная занятость	Java_JDBC_ORACLE_NoSQL_SQL	False	Академсервис	300000.0		False	RUR
False	Токарь	False	Уфа	54.732309	55.93494	Уфа, улица Зенцова, 70	От 1 года до 3 лет	Полный день	Полная занятость	Работа в условиях многозадачности	False	УНПП МОЛНИЯ	50000.0		False	RUR
False	Инженер технической поддержки	False	N/A	N/A	N/A	N/A	От 1 года до 3 лет	Полный день	Полная занятость	Настройка ПК_Настройка сетевых подключений_Настройка ПО_Ремонт ПК_Active Directory	False	Ноль Один Групп	60000.0	65000.0	False	RUR
False	Механик по транспорту	False	N/A	N/A	N/A	N/A	От 1 года до 3 лет	Полный день	Полная занятость	Знание устройства автомобиля_Мобильность_Пользователь ПК_Списание ТМЦ	False	Альянсстрой	70000.0	120000.0	False	RUR
False	Senior Full Stack developer	False	Таганрог	47.216851	38.918522	Таганрог, Гоголевский переулок, 6	От 3 до 6 лет	Полный день	Полная занятость		False	Дунайс	170000.0		True	RUR
False	Разработчик Python	False				Москва,м. Автозаводская, Ослябинский переулок, 3	От 1 года до 3 лет	Полный день	Полная занятость	Python_PostgreSQL_Git_ООП_SQL_MS SQL Server_Django Framework_Delphi	False	Компания Дилявер	160000.0	200000.0	True	RUR
False	Токарь станков с ЧПУ	False	Самара	53.190672	50.25279	Самара, улица 22 Партсъезда, 10А	От 3 до 6 лет	Полный день	Полная занятость	проведение опросов общественного мнения_Умение читать чертежи_Работа в условиях многозадачности_Чертежи_Работа с чертежами	False	Строммашина-Щит	50000.0	50000.0	False	RUR
False	Программист 1С	False	Пермь	58.015261	56.286666	Пермь, улица Дружбы, 15А	От 1 года до 3 лет	Полный день	Полная занятость	1С программирование_SQL_Разработка ПО_Системное мышление_1С: Предприятие_1С: Предприятие 8_1С: Бухгалтерия_1С: Зарплата и управление персоналом_1С: Управление Торговлей_Обновление конфигурации 1С	False	Oxtron	90000.0	100000.0	False	RUR
False	Системный администратор	False	Санкт-Петербург	59.8515545929	30.2992024993	Санкт-Петербург, Ленинский проспект, 149к1	От 1 года до 3 лет	Полный день	Полная занятость		False	Базис	80000.0	80000.0	True	RUR
False	Механик	False	Омск	54.902542	73.300865	Омск, 3-я Казахстанская улица, 18	От 1 года до 3 лет	Полный день	Полная занятость	Пользователь ПК_Ремонтные работы_Техническое обслуживание_Слесарные работы_Контроль исправности оборудования	False	МАГНИТ	47000.0	47000.0	False	RUR
False	Автомеханик	False	посёлок Парголово	60.09774	30.243347	посёлок Парголово, Горское шоссе, 6	От 1 года до 3 лет	Полный день	Полная занятость	Пользователь ПК_Слесарные работы_Техническое обслуживание_Учет запасных частей_Контроль выполненных работ	False	Petshopru	50000.0	55000.0	False	RUR
False	Оператор ЧПУ	False	N/A	N/A	N/A	N/A	От 1 года до 3 лет	Полный день	Полная занятость		False	ПТФК ЗТЭО	65000.0		False	RUR
False	Менеджер сопровождения B2C клиентов	False	Екатеринбург	56.84291	60.625529	Екатеринбург, улица Бажова, 79	От 1 года до 3 лет	Полный день	Полная занятость	Деловое общение_Клиентоориентированность_Развитие продаж_Linux_Грамотная речь	False	Планета	35000.0		False	RUR
False	Механизатор-комбайнер	False	Кашин	57.361939	37.607745	Кашин	От 1 года до 3 лет	Полный день	Полная занятость	Умение работать в команде_Сельское хозяйство	False	РУМЕЛКО	80000.0	125000.0	False	RUR
False	Оператор токарно-фрезерного станка с ЧПУ	False				Березовский, улица Овощное отделение, д. 16	От 1 года до 3 лет	Полный день	Полная занятость	Чтение чертежей_Контроль качества_Станки ЧПУ_Чистое производство_Технический склад ума_токарно-фрезерный станок	False	Группа компаний «СИБЕКО»	70000.0		False	RUR
False	UI/UX дизайнер	False	Таганрог	47.211698	38.935212	Таганрог, Петровская улица, 62	Нет опыта	Полный день	Полная занятость	Adobe Photoshop_Дизайн интерфейсов_UI_UX_Figma_Adobe Illustrator_Дизайн_Adobe Experience Design	False	ИТРУМ	30000.0		False	RUR
False	Старший инженер группы автоматизации	False	село Серёдка	58.158938	28.195754	село Серёдка, Железнодорожная улица, 7	Нет опыта	Полный день	Полная занятость	Настройка ПК_Настройка ПО_Настройка сетевых подключений_Ремонт ПК_Windows 7	False	ФКУ ЦИТОВ УФСИН России Псковской Области	35000.0	45000.0	False	RUR
False	Механик	False	N/A	N/A	N/A	N/A	От 3 до 6 лет	Полный день	Полная занятость	Умение работать в команде_Навыки составления отчетности_Навыки работы с первичной документацией_Умение работать в коллективе_MS Dos_транспорт	False	Технологии Логистических Услуг и Услуг Складского Хранения	80000.0	100000.0	True	RUR
False	Программист 1С	False	Киров	58.592956	49.669792	Киров, улица Карла Маркса, 112	От 1 года до 3 лет	Полный день	Полная занятость	Знание 1С	False	ФГБОУ ВО Кировский ГМУ Минздрава России	65000.0		False	RUR
False	Механик автомобильного парка	False	N/A	N/A	N/A	N/A	От 3 до 6 лет	Полный день	Полная занятость	Аренда автомобилей_Транспортная инфраструктура_Работа в условиях многозадачности_Планирование и организация	False	Крестьянское Фермерское Хозяйство Мичуринский	50000.0	50000.0	True	RUR
False	Оператор листогибочного пресса	False	Новосибирск	55.115326	82.993768	Новосибирск, Тайгинская улица, 11к124	От 1 года до 3 лет	Полный день	Полная занятость	Работа в команде	False	Алмаз	60000.0	120000.0	False	RUR
False	Специалист технической поддержки	False	Кемерово	55.354318	86.063105	Кемерово, Карболитовская улица, 20	Нет опыта	Полный день	Полная занятость		False	ТД АСК	33000.0		False	RUR
False	Помощник сервисного инженера	False	N/A	N/A	N/A	N/A	Нет опыта	Полный день	Полная занятость	Пользователь ПК_Работа в команде_Поиск информации в интернет_Стабильность_Внимательность_Ответственность_Грамотная речь_Обучаемость	False	Белых Роман Валентинович	95000.0		False	RUR
False	Программист (С++, С#)	False	N/A	N/A	N/A	N/A	От 3 до 6 лет	Полный день	Полная занятость	C++_C#_.NET Framework_SQL_Git_Творческое мышление_Работа в команде	False	СНК	40000.0		False	RUR
False	Специалист по тестированию ПО	False					От 1 года до 3 лет	Полный день	Полная занятость		False	Аспект	50000.0	100000.0	False	RUR
False	Android разработчик мобильных приложений / Android Developer	False	N/A	N/A	N/A	N/A	От 1 года до 3 лет	Полный день	Полная занятость	Android_developer_mobile apps_Media Buying_Разработчик	False	Логинов Егор	2000.0	4000.0	False	USD
False	Оператор станков с программным управлением	False	Москва	55.705858	37.725487	Москва, Волгоградский проспект, 42	От 3 до 6 лет	Полный день	Полная занятость		False	Руслет	80500.0		True	RUR
False	Python Backend Engineer, Remote	False	N/A	N/A	N/A	N/A	От 3 до 6 лет	Полный день	Полная занятость	Python_AWS_Heroku_English	False	ГК ВИЗАВИ Консалт	4000.0	5000.0	False	EUR
False	Руководитель направления по комплектации строительных объектов	False	N/A	N/A	N/A	N/A	Более 6 лет	Полный день	Полная занятость	Ведение переговоров_Активные продажи_Обучение и развитие_Развитие продаж_Клиентоориентированность_Умение работать в команде_Ориентация на результат	False	Вист-К	40000.0	120000.0	True	RUR
False	Руководитель проекта	False	N/A	N/A	N/A	N/A	От 1 года до 3 лет	Полный день	Полная занятость	Управление проектами_MS Project_Деловая переписка_MS PowerPoint_Строительство	False	СетьСтройПроект	300000.0		False	RUR
False	Системный администратор	False	Новосибирск	55.0809	82.977059	Новосибирск, улица Писемского, 9	От 1 года до 3 лет	Полный день	Полная занятость	Работа с оргтехникой_MS SQL_Закупка оргтехники и оборудования_Решение проблем_Администрирование серверов_Настройка ПК_Работа в условиях многозадачности_Windows Server	False	RedIT (ИП Орешин Сергей Евгеньевич)	50000.0		False	RUR
False	Инженер связи	False	Екатеринбург	56.841325	60.666699	Екатеринбург, улица Малышева, 164	От 1 года до 3 лет	Полный день	Полная занятость	Тестирование и испытания оборудования систем связи_Выполнение пусконаладочных работ	False	Уралэнерготел	80000.0	125000.0	True	RUR
False	Системный администратор	False	N/A	N/A	N/A	N/A	От 3 до 6 лет	Полный день	Полная занятость	Работа с ПК_Высокий уровень дисциплины_Внимательность, ответственность	False	ЗАКИРОВА АЛСУ		75000.0	True	RUR
False	Монтажник слаботочных сетей/техник	False	Кашира	54.834589	38.15154	Кашира	Нет опыта	Полный день	Полная занятость	Настройка сетевых подключений_Настройка ПК_Прокладка кабелей_Оптоволокно_Настройка сетевого оборудования	False	ПВОНЕТ	40000.0	60000.0	False	RUR
False	Full Stack JS/Node.js разработчик	False	N/A	N/A	N/A	N/A	От 3 до 6 лет	Полный день	Полная занятость	JavaScript_PHP_CSS_HTML_Notion_ReactJS_Удаленная работа	False	3205.team		2000.0	True	USD
False	Арт-менеджер	False	Сочи	43.575651	39.726709	Сочи, микрорайон Центральный, улица Орджоникидзе, 17	От 1 года до 3 лет	Полный день	Полная занятость	Навыки продаж_Проведение презентаций_Поиск и привлечение клиентов_Деловая переписка_Холодные продажи_Пользователь ПК_работа с VIP клиентами_Управление отношениями с клиентами_Активные продажи_Точность и внимательность к деталям	False	Галерея современного ювелирного искусства Частная коллекция	40000.0	100000.0	True	RUR
False	Инженер-программист	False	Москва	55.748979	37.588718	Москва, улица Арбат, 36/2с3	От 3 до 6 лет	Полный день	Полная занятость	Git_SQL_Python_JavaScript_Linux_Разработка ПО_HTML_C#_ООП_C/C++_C++_.NET Framework	False	Rubetek	100000.0	250000.0	False	RUR
False	Инженер службы технической поддержки	True	Москва	55.692318	37.347485	Москва, Западный административный округ, Можайский район, Инновационный центр Сколково, Большой бульвар, 42с1	От 1 года до 3 лет	Полный день	Полная занятость	Грамотная речь_Работа с большим объемом информации_Клиентоориентированность_Работа с жалобами клиентов_Работа с претензиями_Навыки делового общения_Индивидуальный подход к клиенту_Техническая поддержка_Работа с ключевыми клиентами_Информационная логистика_Высокий уровень самоорганизации_Умение легко находить контакт с людьми_SaaS_Грамотная устная и письменная речь_Опытный пользователь ПК_SQL_Умение анализировать_JSON API_Администрирование серверов Linux_Администрирование серверов Windows_Python_JavaScript_GraphQL_REST API	False	ТН Цифровая Логистика	80000.0		False	RUR
False	Sales manager (Español C1)	False	Москва	55.798935	37.531199	Москва, Ленинградский проспект, 47с3	Нет опыта	Полный день	Полная занятость	Грамотная речь_Деловое общение_Испанский язык_Работа с существующей базой клиентов	False	Тэ Амо Консалтинг	70000.0		True	RUR
False	Тестировщик ПО (QA Engineer)	False	Ростов-на-Дону	47.267627	39.732153	Ростов-на-Дону, Измаильский переулок, 41А	От 1 года до 3 лет	Полный день	Полная занятость	Тестирование_Тестирование пользовательского интерфейса_Проведение тестирований_Умение принимать решения_Повышенная внимательность к объекту тестирования_умение замечать и выводить закономерные факты	False	Цифровые Контрольные Технологии	35000.0	50000.0	False	RUR
False	Оператор станков с ЧПУ	False	Брянск	53.211768	34.435785	Брянск, Московский проспект, 86	От 1 года до 3 лет	Полный день	Полная занятость	Станки ЧПУ	False	Веза	50000.0		False	RUR
